,Name,Steffi Behanan,Mahesh Natarajan,Dr. Sandip Deshpande,Pinki Solanki,Dr. Mahesh R Gowda,Manisha Shastri,Rohini Rajeev,Gayitri Bhatt,Varun Kaul,Father Pancratius,Varun Kaul.1,Dr. Bhupendra Chaudhry,Dr. Prabha Chandra,Manju,Riddhi Khandwal,Kalyanasundaram,Dr. Pallavi Tomar,Akshara Damle,Anita Rajnarayan,Simi Matthew,Hema Sampath,Chaitra Mahesh,Amita Bala,Christopher David Skill,Nithya J Rao,Dr. Prabha Chandra.1,Manju.1,Sukanya Ananth
0,What is their age range?,20-29,40-49,40-49,40-49,Don't know,20-29,30-39,60-69,30-39,40-49,30-39,Don't know,60-69,40-49,30-39,50-59,20-29,20-29,40-49,30-39,40-49,30-39,40-49,50-59,20-29,60-69,40-49,40-49
1,Which gender do they identify with?,Female,Male,Male,Female,Male,Female,Female,Female,Male,Male,Male,Male,Female,,Female,Male,Female,Male,Female,Female,Female,Female,Female,Male,Gender Fluid,Female,,Female
2,What is the title of the mental health professional that you are recommending? ,Clinical Psychologist,Counsellor/Psychotherapist,Psychiatrist,Expressive and Creative Arts therapist,Psychiatrist,Peer supporter,Counsellor/Psychotherapist,Counsellor/Psychotherapist,Counsellor/Psychotherapist,Clinical Psychologist,Counsellor/Psychotherapist,Psychiatrist,Psychiatrist,Counsellor/Psychotherapist,Clinical Psychologist,Psychiatrist,Clinical Psychologist,Counsellor/Psychotherapist,Alternative therapy,Counsellor/Psychotherapist,Clinical Psychologist,Counsellor/Psychotherapist,Counsellor/Psychotherapist,Counsellor/Psychotherapist,Rehabilitation Psychologist,Psychiatrist,Counsellor/Psychotherapist,Counsellor/Psychotherapist
3,Which city/town do they practice in? ,Banglore,Bangalore,Bangalore,Bengaluru,Bangalore,Bangalore,Bangalore,Bangalore,Bangalore,Bangalore,Bangalore,Bangalore,Bengaluru,Bangalore,Bengaluru,Bangalore,Bangalore,Bengaluru,Bangalore,Bangalore,Bengaluru,Bangalore,Bangalore,Bangalore,Bangalore,Bengaluru,Bangalore,Bangalore
4,Which language(s) are they conversant in? ,"English, hindi, Malayalam, bengali","english, tamil","English, Kannada, Hindi","English, Hindi","Kannada, English and Hindi","English, Hindi","Malayalam, Hindi, Tamil, Kannada & English","English, Hindi, Kannada, Gujarati","Hindi, English","English, Malayalam, Hindi, Tamil","Hindi, English","English, Hindi","Hindi, English, kannada",English,,,,"English, Hindi, Kannada","English, Hindi, Tamil, Kannada",English,"English, Tamil, kannada, hindi","English, Kannada, Hindi","English, Tamil",English,English Hindi Kannada,"Hindi, English, kannada",English,English
5,What are their professional qualifications?,M.phil (with RCI),MS (Counselling & psychotherapy),"MB BS, MD (Psychiatry), DPM, MRCPsych, CCT (UK), PGDip (Sexual & Relationship Psychotherapy",,"MBBS , Diploma in Psychological Medicine , DNB (Psychiatry)",,MSW-Medicine & Psychiatry; Pursuing PhD in Applied Psychology,"MD, MSc, EMDR Certificate",,"Masters in psychology, PhD",,"MBBS, MD - Psychiatry",,,English,"Kannada, English, Tamil",English,MSc Psychology,,,,M.Sc Psychological Counselling,"M.Sc . (Psychology);B.Com.; ACCA ; CPA ; Certificate in Counselling (BSIC); Certificate in Child and Adolescent Counselling, Certificate in Couple and Family Counselling;",,Masters in Rehabilitation and Counselling,,,"MSc, Psychotherapy"
6,What is their contact number?,8095132195,9886910917,91 80 42199437,9741334888,919035560000 / 080 23493157 / 080 23595652,8861512959,8892041947,9448040240,9686581821,9480429086,9686581821,91-9980524700,91 98 80 383057,91 80 25298686,,MD,,8447908644,9741399482,6391-559859,98802 63815,8095321705,9845092845,8971832591,7892551372,98 80 383057,80 25298686,9845071147
7,What is their email address?,,mahesh@innersight.in,,,,,rohinirajeev@outlook.com,gayitribhatt,,,,drbchaudhry@yahoo.co.in,,,98 86 947485,22442241,9930861110,aksharadamle@manosamvaada.com,,simi.reuben@gmail.com,,Chaitra.msh@gmail.com,balaamita@gmail.com,,nithyajrao@gmail.com,,,
